Book Id,Title,Author,Author l-f,Additional Authors,ISBN,ISBN13,My Rating,Average Rating,Publisher,Binding,Number of Pages,Year Published,Original Publication Year,Date Read,Date Added,Bookshelves,Bookshelves with positions,Exclusive Shelf,My Review,Spoiler,Private Notes,Read Count,Owned Copies
40597264,Hacking Darwin: Genetic Engineering and the Future of Humanity,Jamie Metzl,"Metzl, Jamie",,"=""149267009X""","=""9781492670094""",0,4.00,Sourcebooks,Hardcover,327,2019,2019,,2022/02/10,to-read,to-read (#216),to-read,,,,0,0
24156733,"Extinction Horizon (Extinction Cycle, #1)",Nicholas Sansbury Smith,"Smith, Nicholas Sansbury",,"=""""","=""""",0,3.98,Orbit,Kindle Edition,351,2014,2014,,2022/02/09,to-read,to-read (#215),to-read,,,,0,0
27867828,"Ultrasociety: How 10,000 Years of War Made Humans the Greatest Cooperators on Earth",Peter Turchin,"Turchin, Peter",,"=""""","=""""",0,4.12,Beresta Books,Kindle Edition,274,2015,2015,,2022/01/28,to-read,to-read (#214),to-read,,,,0,0
17906571,Einstein's Relativity and the Quantum Revolution: Modern Physics for Non-Scientists,Richard Wolfson,"Wolfson, Richard",,"=""""","=""9781565852808""",5,4.31,The Great Courses,Audio CD,,2000,2000,2022/01/21,2022/01/10,,,read,"Bit dated, refers to past experiments as future ones. Still an excellent foundation building course.",,,1,0
34234639,"The Land: Founding (Chaos Seeds, #1)",Aleron Kong,"Kong, Aleron",,"=""1535020709""","=""9781535020701""",0,4.18,CreateSpace Independent Publishing Platform,Paperback,252,2015,2015,,2022/01/21,abandoned,abandoned (#14),abandoned,,,,0,0
35510008,This is Going to Hurt: Secret Diaries of a Junior Doctor,Adam Kay,"Kay, Adam",,"=""""","=""""",5,4.41,Picador,Kindle Edition,285,2017,2017,2022/01/20,2021/05/23,,,read,"Excellent, brutally honest with sharp humor. Bit gross but c'est la vie. Must read.",,,2,0
25855506,"Adulthood Is a Myth (Sarah's Scribbles, #1)",Sarah Andersen,"Andersen, Sarah",,"=""1449474195""","=""9781449474195""",0,4.12,Andrews McMeel Publishing,Paperback,112,2016,2016,,2022/01/19,to-read,to-read (#213),to-read,,,,0,0
59452404,The Vanishing Half,Brit Bennett,"Bennett, Brit",,"=""0525536965""","=""9780525536963""",0,4.15,Riverhead Books,Paperback,389,2022,2020,,2022/01/19,to-read,to-read (#212),to-read,,,,0,0
59999991,Klara and the Sun,Kazuo Ishiguro,"Ishiguro, Kazuo",,"=""0593311299""","=""9780593311295""",0,3.75,Vintage,Paperback,303,2022,2021,,2022/01/15,to-read,to-read (#211),to-read,,,,0,0
34110923,Medical School for Everyone: Grand Rounds Cases,Roy Benaroch,"Benaroch, Roy",,"=""""","=""9781629970677""",5,4.29,The Teaching Company,Audio CD,,2014,2014,2022/01/10,2022/01/04,,,read,"Extremely accessible to a layman, educational and interesting.",,,1,0
8508,The Jefferson Bible: The Life and Morals of Jesus of Nazareth,Thomas Jefferson,"Jefferson, Thomas",,"=""1557091846""","=""9781557091840""",1,3.87,Applewood Books,Hardcover,104,2006,1819,2022/01/07,2021/06/16,,,read,"The deist approach to the Bible. I was promised a ""scientific perspective"", which is simply untrue.",,,1,0
29579,"Foundation (Foundation, #1)",Isaac Asimov,"Asimov, Isaac",,"=""0553803719""","=""9780553803716""",3,4.17,Bantam,Hardcover,244,2004,1951,2022/01/07,2021/10/01,,,read,,,,1,0
39909963,"Law School for Everyone:  Litigation, Criminal Law, Civil Procedure, and Torts",Edward K. Cheng,"Cheng, Edward K.","Joseph L. Hoffmann, Molly Bishop Shadel, Peter J. Smith","=""""","=""""",5,4.28,The Great Courses,Audible Audio,26,2017,,2022/01/04,2021/12/22,,,read,"Insightful summary of the US legal system. The application of logic to ethics is interesting, but I can't help wonder at the lack of flexibility from a system based so heavily on precedent with regard to societal progress.<br/><br/>Both educational and a fascinating series.",,,1,0
52722079,The Pull of the Stars,Emma Donoghue,"Donoghue, Emma",,"=""0316499013""","=""9780316499019""",0,3.96,"Little, Brown and Company",Hardcover,295,2020,2020,,2021/12/29,to-read,to-read (#210),to-read,,,,0,0
31443093,Music as a Mirror of History,Robert Greenberg,"Greenberg, Robert",,"=""""","=""""",5,4.26,The Teaching Company,Audible Audio,19,2016,2016,2021/12/22,2021/11/22,,,read,,,,1,0
36461143,"Retribution (Awaken Online, #2.5)",Travis Bagwell,"Bagwell, Travis",,"=""""","=""""",3,4.39,,Kindle Edition,277,2017,2017,2021/12/20,2021/12/18,,,read,"Much like the other books in this series, the story is enjoyable while the writing leaves much to be desired. It reads like a YA book with a few cuss words added.",,,1,0
34667573,"Skulduggery Pleasant (Skulduggery Pleasant, #1)",Derek Landy,"Landy, Derek",,"=""0008248788""","=""9780008248789""",0,4.18,HarperCollinsChildren’sBooks,Paperback,384,2018,2007,,2021/12/19,to-read,to-read (#209),to-read,,,,0,0
59716,To the Lighthouse,Virginia Woolf,"Woolf, Virginia",Eudora Welty,"=""""","=""""",0,3.80,Harvest Books,Paperback,209,1989,1927,,2021/12/18,to-read,to-read (#208),to-read,,,,0,0
6149,Beloved,Toni Morrison,"Morrison, Toni",,"=""""","=""9781400033416""",0,3.95,Vintage,Paperback,324,2004,1987,,2021/12/18,to-read,to-read (#207),to-read,,,,0,0
656,War and Peace,Leo Tolstoy,"Tolstoy, Leo","Aylmer Maude, Louise Maude","=""""","=""""",0,4.16,Oxford University Press,Paperback,1392,1998,1868,,2021/12/15,abandoned,abandoned (#13),abandoned,,,,0,0
40940649,I Am Legend,Richard Matheson,"Matheson, Richard",,"=""0795315635""","=""""",3,4.06, RosettaBooks ,Kindle Edition,162,2011,1954,2021/12/15,2020/08/19,,,read,,,,1,0
149267,The Stand,Stephen King,"King, Stephen",Bernie Wrightson,"=""""","=""""",0,4.35,Doubleday Books,Hardcover,1152,1990,1990,,2020/01/29,abandoned,abandoned (#12),abandoned,,,,0,0
58345,The Awakening,Kate Chopin,"Chopin, Kate",,"=""0543898083""","=""9780543898081""",0,3.68,Elibron Classics,Paperback,195,2006,1899,,2021/05/12,"wmpa, abandoned","wmpa (#6), abandoned (#11)",abandoned,,,,0,0
76171,We,Yevgeny Zamyatin,"Zamyatin, Yevgeny",Clarence Brown,"=""0140185852""","=""9780140185850""",0,3.89,Penguin Twentieth Century Classics,Paperback,226,1993,1924,,2021/12/12,to-read,to-read (#206),to-read,,,,0,0
17237214,Two Boys Kissing,David Levithan,"Levithan, David",,"=""0307931900""","=""9780307931900""",4,4.08,Knopf Books for Young Readers,Hardcover,200,2013,2013,2021/12/11,2020/06/30,,,read,"An incredibly important story that needed telling. There is much enthusing in other reviews and I feel I can't add further to those. I did feel like the writing itself was a little shaky at times and lacking flow, as if it could have done with more editing. Also, I listened to this rather than read it, and I didn't enjoy the narrator's amateur sounding recording: odd changes in volume, poor voice acting.<br/><br/>Overall well worth the read, and I hope this is read by many young LGBT+ peoples, as it may save a life.",,,1,0
5812,V for Vendetta,Steve Moore,"Moore, Steve","Lilly Wachowski, Lana Wachowski, Alan Moore","=""1416516999""","=""9781416516996""",5,4.15,Pocket Star,Mass Market Paperback,368,2006,1989,2021/12/10,2021/12/08,,,read,Feels like a mix of the film with additional considerations added.,,,1,0
53205888,Under the Whispering Door,T.J. Klune,"Klune, T.J.",,"=""1250217342""","=""9781250217349""",0,4.16,Tor Books,Hardcover,384,2021,2021,,2021/12/10,to-read,to-read (#205),to-read,,,,0,0
53056522,Mediocre: The Dangerous Legacy of White Male America,Ijeoma Oluo,"Oluo, Ijeoma",,"=""1580059511""","=""9781580059510""",0,4.41,Seal Press,Hardcover,278,2020,2020,,2021/12/10,to-read,to-read (#204),to-read,,,,0,0
55338982,Cultish: The Language of Fanaticism,Amanda Montell,"Montell, Amanda",,"=""0062993151""","=""9780062993151""",0,3.88,Harper,Hardcover,309,2021,2021,,2021/12/10,to-read,to-read (#203),to-read,,,,0,0
54120408,Klara and the Sun,Kazuo Ishiguro,"Ishiguro, Kazuo",,"=""059331817X""","=""9780593318171""",0,3.75,Alfred A. Knopf,Hardcover,303,2021,2021,,2021/12/10,to-read,to-read (#202),to-read,,,,0,0
52379735,The Echo Wife,Sarah Gailey,"Gailey, Sarah",,"=""125017466X""","=""9781250174666""",0,3.61,Tor Books,Hardcover,256,2021,2021,,2021/12/10,to-read,to-read (#201),to-read,,,,0,0
41568962,"Avatar: The Rise of Kyoshi (The Kyoshi Novels, #1)",F.C. Yee,"Yee, F.C.",Michael Dante DiMartino,"=""1683355334""","=""9781683355335""",0,4.45,Amulet Books,Kindle Edition,461,2019,2019,,2020/07/10,abandoned,abandoned (#10),abandoned,,,,0,0
55145261,The Anthropocene Reviewed,John Green,"Green, John",,"=""0525555218""","=""9780525555216""",4,4.37,Dutton,Hardcover,293,2021,2021,2021/12/04,2021/09/08,,,read,Rating this book feels rather meta. Four stars.,,,1,0
50623864,The Invisible Life of Addie LaRue,V.E.  Schwab,"Schwab, V.E.",,"=""0765387565""","=""9780765387561""",5,4.19,Tor Books,Hardcover,448,2020,2020,2021/12/02,2021/05/06,,,read,An excellent read.,,,1,0
70535,2001: A Space Odyssey,Arthur C. Clarke,"Clarke, Arthur C.",,"=""""","=""""",3,4.17,Roc,Paperback,297,2000,1968,2021/12/02,2021/10/30,,,read,Really enjoyed the first 90%.,,,1,0
58673915,The Sun Also Rises,Ernest Hemingway,"Hemingway, Ernest",,"=""1982199520""","=""9781982199524""",0,3.79,Pocket Books,Mass Market Paperback,272,2021,1926,,2021/12/01,to-read,to-read (#200),to-read,,,,0,0
49338237,"Spellbreaker (Spellbreaker Duology, #1)",Charlie N. Holmberg,"Holmberg, Charlie N.",,"=""1542020107""","=""9781542020107""",3,4.07,47North,Kindle Edition,327,2020,2020,2021/11/27,2021/03/12,,,read,,,,1,0
10847,Under the Banner of Heaven: A Story of Violent Faith,Jon Krakauer,"Krakauer, Jon",,"=""0330419129""","=""9780330419123""",0,4.01,Pan MacMillan,Paperback,400,2004,2003,,2021/11/26,to-read,to-read (#199),to-read,,,,0,0
4981,Slaughterhouse-Five,Kurt Vonnegut Jr.,"Jr., Kurt Vonnegut",,"=""0385333846""","=""9780385333849""",0,4.10,Dial Press,Paperback,275,1999,1969,,2020/06/14,abandoned,abandoned (#9),abandoned,,,,0,0
40956725,"Apathy (Awaken Online, #3.5)",Travis Bagwell,"Bagwell, Travis",,"=""""","=""""",4,4.35,,Kindle Edition,342,2018,,2021/11/24,2021/11/23,,,read,,,,1,0
1845,Into the Wild,Jon Krakauer,"Krakauer, Jon",,"=""0385486804""","=""9780385486804""",2,4.01,Anchor Books,Paperback,203,1997,1996,2021/11/23,2020/07/12,,,read,,,,1,0
59058504,"The Atlas Six (The Atlas, #1)",Olivie Blake,"Blake, Olivie",,"=""1250854512""","=""9781250854513""",0,3.61,Tor Books,Hardcover,376,2022,2020,,2021/11/22,to-read,to-read (#198),to-read,,,,0,0
2165,The Old Man and the Sea,Ernest Hemingway,"Hemingway, Ernest",,"=""0684830493""","=""9780684830490""",5,3.80,Scribner,Hardcover,96,1996,1952,2021/11/21,2020/06/14,,,read,"This feels like speaking with the hardships of recent human history. The hardships of a working man, the realization of age creeping up on your body, and of folly in the face of lengthy hardships.",,,1,0
39999,The Boy in the Striped Pajamas,John Boyne,"Boyne, John",,"=""""","=""""",5,4.16,David Fickling Books,Hardcover,224,2006,2006,2021/11/20,2021/03/30,,,read,,,,1,0
33916060,"Blackwing (Raven's Mark, #1)",Ed McDonald,"McDonald, Ed",,"=""0399587799""","=""9780399587795""",0,4.10,Ace,Paperback,360,2017,2017,,2021/11/20,to-read,to-read (#197),to-read,,,,0,0
5752,The Blank Slate: The Modern Denial of Human Nature,Steven Pinker,"Pinker, Steven",,"=""0142003344""","=""9780142003343""",0,4.09,Penguin Books,Paperback,560,2003,2002,,2021/11/19,to-read,to-read (#196),to-read,,,,0,0
18774964,A Man Called Ove,Fredrik Backman,"Backman, Fredrik",Henning Koch,"=""1476738017""","=""9781476738017""",4,4.38,Atria Books,Hardcover,337,2014,2012,2021/11/17,2020/09/16,,,read,I cried.,,,1,0
20883847,"The Autumn Republic (Powder Mage, #3)",Brian  McClellan,"McClellan, Brian",,"=""0316219126""","=""9780316219129""",5,4.36,Orbit,Hardcover,580,2015,2015,2021/11/15,2020/04/01,,,read,,,,1,0
944073,"The Blade Itself (The First Law, #1)",Joe Abercrombie,"Abercrombie, Joe",,"=""0575079797""","=""9780575079793""",0,4.21,Gollancz,Paperback,515,2007,2006,,2021/11/14,to-read,to-read (#195),to-read,,,,0,0
46252715,"Unity (Awaken Online, #4.5)",Travis Bagwell,"Bagwell, Travis",,"=""""","=""""",3,4.58,,Kindle Edition,361,2019,2019,2021/11/11,2021/11/08,,,read,,,,1,0
44154519,"Dominion (Awaken Online, #4)",Travis Bagwell,"Bagwell, Travis",,"=""""","=""""",3,4.42,,Kindle Edition,801,2019,2019,2021/11/08,2021/11/04,,,read,"The writing is not fantastic, but the story is, the setting is and the characters are mostly great. I say mostly, because I have to exclude the gay cousin who ""likes shopping"" - c'mon Travis, do you realize gay people actually are people and not caricatures? Also, the cheesy romance lines between Jason and Riley were, well, cheesy.",,,1,0
36857712,The Columbian Orator,Caleb Bingham,"Bingham, Caleb",,"=""1375624601""","=""9781375624602""",0,3.80,Andesite Press,Paperback,310,2017,1797,,2020/09/07,to-read,to-read (#79),to-read,,,,0,0
40206384,"Evolution (Awaken Online, #3)",Travis Bagwell,"Bagwell, Travis",,"=""""","=""""",4,4.39,,Kindle Edition,768,2018,2018,2021/11/02,2021/10/28,,,read,,,,1,0
43763,"Interview with the Vampire (The Vampire Chronicles, #1)",Anne Rice,"Rice, Anne",,"=""0345476875""","=""9780345476876""",3,4.02,Ballantine Books,Paperback,346,2004,1976,2021/11/02,2020/06/08,,,read,,,,1,0
562421,Diogenes The Cynic: The War Against The World,Luis E. Navia,"Navia, Luis E.",,"=""1591023203""","=""9781591023203""",0,4.04,Humanity Books,Paperback,260,2005,2005,,2021/10/31,to-read,to-read (#194),to-read,,,,0,0
22544764,Uprooted,Naomi Novik,"Novik, Naomi",,"=""0804179034""","=""9780804179034""",3,4.04,Del Rey,Hardcover,438,2015,2015,2021/10/29,2021/02/25,,,read,,,,1,0
41886271,The Sword of Kaigen,M.L.  Wang,"Wang, M.L.",,"=""""","=""""",0,4.47,Amazon Digital Services,Kindle Edition,651,2019,2018,,2021/10/29,to-read,to-read (#193),to-read,,,,0,0
33839035,"Precipice (Awaken Online, #2)",Travis Bagwell,"Bagwell, Travis",,"=""""","=""""",5,4.43,,Kindle Edition,594,2017,2017,2021/10/27,2021/10/17,,,read,,,,1,0
31799,The Problems of Philosophy,Bertrand Russell,"Russell, Bertrand",,"=""1421903679""","=""9781421903675""",0,3.91,Indypublish.Com,Paperback,116,2005,1912,,2021/10/27,to-read,to-read (#192),to-read,,,,0,0
1079543,Readings in Ancient Greek Philosophy: From Thales to Aristotle,C.D.C. Reeve,"Reeve, C.D.C.",,"=""087220538X""","=""9780872205383""",0,4.12,Hackett Pub Co Inc,Paperback,890,2000,1995,,2021/10/27,to-read,to-read (#191),to-read,,,,0,0
584637,Utilitarianism,John Stuart Mill,"Mill, John Stuart",George Sher,"=""087220605X""","=""9780872206052""",0,3.68,Hackett Publishing Company,Paperback,71,2002,1861,,2021/10/27,to-read,to-read (#190),to-read,,,,0,0
19068,The Nicomachean Ethics,Aristotle,"Aristotle, Aristotle","Hugh Tredennick, J.A.K. Thomson, Jonathan Barnes","=""0140449493""","=""9780140449495""",0,3.99,Penguin Classics,Paperback,329,2004,-350,,2021/10/27,to-read,to-read (#189),to-read,,,,0,0
18912,The Sublime Object of Ideology,Slavoj Žižek,"Žižek, Slavoj",,"=""0860919714""","=""9780860919711""",0,4.07,Verso,Paperback,256,1989,1989,,2021/10/27,to-read,to-read (#188),to-read,,,,0,0
22055262,"A Darker Shade of Magic (Shades of Magic, #1)",V.E.  Schwab,"Schwab, V.E.",,"=""0765376458""","=""9780765376459""",5,4.06,Tor,Hardcover,400,2015,2015,2021/10/24,2021/09/07,,,read,,,,1,0
7171637,"Clockwork Angel (The Infernal Devices, #1)",Cassandra Clare,"Clare, Cassandra",,"=""1416975861""","=""9781416975861""",2,4.31,Margaret K. McElderry Books,Hardcover,479,2010,2010,2021/10/22,2020/09/16,,,read,,,,1,0
28187,"The Lightning Thief (Percy Jackson and the Olympians, #1)",Rick Riordan,"Riordan, Rick",,"=""""","=""""",0,4.31,Disney Hyperion Books,Paperback,377,2006,2005,,2020/06/14,abandoned,abandoned (#8),abandoned,,,,0,0
332613,One Flew Over the Cuckoo’s Nest,Ken Kesey,"Kesey, Ken",,"=""""","=""""",3,4.20,Signet,Mass Market Paperback,325,1963,1962,2021/10/18,2020/03/26,,,read,,,,1,0
183645,Voyage of the Beagle,Charles Darwin,"Darwin, Charles",,"=""014043268X""","=""9780140432688""",0,4.03,Penguin Books,Paperback,432,1989,1839,,2021/10/17,abandoned,abandoned (#7),abandoned,,,,0,0
33827079,"Catharsis (Awaken Online, #1)",Travis Bagwell,"Bagwell, Travis",,"=""""","=""""",4,4.39,Amazon Digital Services,Kindle Edition,525,2017,2016,2021/10/17,2021/10/14,,,read,,,,1,0
30289,The Republic,Plato,"Plato, Plato",Desmond Lee,"=""0140449140""","=""9780140449143""",3,3.96,Penguin Classics,Paperback,416,2003,-375,2021/10/14,2019/07/05,,,read,,,,1,0
30474,The Communist Manifesto,Karl Marx,"Marx, Karl","Friedrich Engels, Leon Trotsky, Samuel Moore, Erkin Özalp, Amanda Lee, Antonio Carlos Braga, Aldrin Alexander Evies, Oqtay Eloğlu","=""0140447571""","=""9780140447576""",0,3.65,Penguin Books,Paperback,288,2002,1848,,2021/10/08,to-read,to-read (#187),to-read,,,,0,0
43902687,"Six Sacred Swords (Weapons and Wielders, #1)",Andrew Rowe,"Rowe, Andrew",,"=""""","=""""",5,4.16,,Kindle Edition,331,2019,2019,2021/10/08,2021/09/26,,,read,,,,1,0
40611328,"Ishmael (Ishmael, #1)",Daniel Quinn,"Quinn, Daniel",,"=""""","=""""",5,4.01,Bantam,Kindle Edition,338,2009,1992,2021/10/04,2021/07/17,,,read,"I applaud this book not because of the writing (although it is terrific), nor because I agree with all of the arguments (though they are persuasive). I applaud this book because it made me question some fundamental aspects of humanity, our place in the world and that perhaps the best cure for a hopeless future is hope.",,,1,0
8909,The War of the Worlds,H.G. Wells,"Wells, H.G.",Arthur C. Clarke,"=""0375759239""","=""9780375759239""",0,3.83,Modern Library,Paperback,192,2002,1898,,2021/07/23,abandoned,abandoned (#5),abandoned,,,,0,0
12015,Feersum Endjinn,Iain M. Banks,"Banks, Iain M.",Manuel Mata Álvarez-Santullano,"=""0553573586""","=""9780553573589""",0,3.84,Spectra,Mass Market Paperback,311,1996,1994,,2020/12/20,abandoned,abandoned (#4),abandoned,,,,0,0
112537,"Rendezvous with Rama (Rama, #1)",Arthur C. Clarke,"Clarke, Arthur C.",,"=""1857231589""","=""9781857231588""",4,4.12,,Paperback,243,2000,1973,2021/10/03,2020/04/15,,,read,,,,1,0
190999,Way Station,Clifford D. Simak,"Simak, Clifford D.",,"=""0020248717""","=""9780020248712""",3,4.03,Collier Books,Paperback,210,1992,1963,2021/10/02,2020/07/23,,,read,,,,1,0
55251323,"The Torch that Ignites the Stars (Arcane Ascension, #3)",Andrew Rowe,"Rowe, Andrew",,"=""""","=""""",5,4.12,,Kindle Edition,571,2020,2020,2021/10/02,2021/09/26,,,read,,,,1,0
40126485,"On the Shoulders of Titans (Arcane Ascension, #2)",Andrew Rowe,"Rowe, Andrew",,"=""""","=""""",5,4.22,,Kindle Edition,742,2018,2018,2021/09/26,2021/09/22,,,read,Thoroughly enjoying this series. Inclusionary writing without it being a major theme - so refreshing. The hard magic system is fascinating.,,,1,0
34403860,"Sufficiently Advanced Magic (Arcane Ascension, #1)",Andrew Rowe,"Rowe, Andrew",,"=""""","=""""",5,4.13,,Kindle Edition,625,2017,2017,2021/09/21,2021/06/23,,,read,,,,1,0
36402034,Do Androids Dream of Electric Sheep?,Philip K. Dick,"Dick, Philip K.",,"=""""","=""""",3,4.09,Ballantine Books,Kindle Edition,258,2008,1968,2021/09/15,2021/09/08,,,read,,,,1,0
39091820,Leviathon,Thomas Hobbes,"Hobbes, Thomas",,"=""""","=""""",0,3.71,Jovian Press,Kindle Edition,774,2017,1651,,2021/09/16,to-read,to-read (#186),to-read,,,,0,0
53199074,Dear NHS: 100 Stories to Say Thank You,Adam Kay,"Kay, Adam",,"=""1398701181""","=""9781398701182""",0,4.24,Orion,Hardcover,408,2022,2020,,2021/09/15,to-read,to-read (#185),to-read,,,,0,0
34928122,Artemis,Andy Weir,"Weir, Andy",,"=""0553448129""","=""9780553448122""",2,3.69,Crown,Hardcover,305,2017,2017,2021/09/13,2021/09/12,,,read,,,,1,0
17608111,"The Crimson Campaign (Powder Mage, #2)",Brian  McClellan,"McClellan, Brian",,"=""0356502023""","=""9780356502021""",4,4.36,Orbit,Hardcover,596,2014,2014,2021/09/12,2020/04/01,,,read,"I kinda wish the only ""lead"" woman wasn't mute, though the author does a good job of making her expressive despite it. Well written and enthralling.",,,1,0
24800,House of Leaves,Mark Z. Danielewski,"Danielewski, Mark Z.",,"=""""","=""""",0,4.09,Random House,Paperback,710,2000,2000,,2021/09/08,to-read,to-read (#184),to-read,,,,0,0
6587879,Horns,Joe Hill,"Hill, Joe",,"=""0061147958""","=""9780061147951""",0,3.93,William Morrow,Hardcover,370,2010,2009,,2021/09/05,to-read,to-read (#183),to-read,,,,0,0
44510181,"Malorie (Bird Box, #2)",Josh Malerman,"Malerman, Josh",,"=""""","=""""",2,3.80,Del Rey,Kindle Edition,301,2020,2020,2021/09/05,2021/09/05,,,read,An unnecessary sequel with mediocre plot points and writing.,,,1,0
66695,"Sojourn (Forgotten Realms: The Dark Elf Trilogy, #3; Legend of Drizzt, #3)",R.A. Salvatore,"Salvatore, R.A.",,"=""1560760478""","=""9781560760474""",3,4.22,Wizards of the Coast,Mass Market Paperback,309,1991,1991,2021/09/05,2021/08/31,,,read,"A tad meandering but enjoyable, with interesting and endearing characters.",,,1,0
166997,Stoner,John  Williams,"Williams, John",John McGahern,"=""1590171993""","=""9781590171998""",5,4.33,New York Review Books,Paperback,288,2006,1965,2021/09/04,2021/06/11,,,read,"Literature reflects upon experiences of life; real or imagined. Stoner is as depressing as all life journey's are, filled with regrets, love, friendships, foes, growth, disappointment and eventually death.<br/><br/>I feel this is a really important book for thanatophobes like myself, because it frames death with the perspective of a life lived.",true,,1,0
25776132,The Brain: The Story of You,David Eagleman,"Eagleman, David",,"=""1101870532""","=""9781101870532""",3,4.26,Pantheon,Hardcover,224,2015,2015,2021/08/30,2019/07/05,,,read,,,,1,0
28247,"Voice of the Gods (Age of the Five, #3)",Trudi Canavan,"Canavan, Trudi",,"=""0060815922""","=""9780060815929""",3,4.10,HarperCollins Publishers Inc.,Mass Market Paperback,574,2007,2007,2021/08/29,2015/04/21,,,read,The ending was much less impressive a second time round.,,,2,0
18386,The Death of Ivan Ilych,Leo Tolstoy,"Tolstoy, Leo","Aylmer Maude, Louise Maude","=""1600964338""","=""9781600964336""",0,4.13,Waking Lion Press,Paperback,86,2006,1886,,2021/08/28,to-read,to-read (#181),to-read,,,,0,0
11337,The Bluest Eye,Toni Morrison,"Morrison, Toni",,"=""""","=""""",0,4.11,Plume,Paperback,216,2005,1970,,2021/08/28,to-read,to-read (#180),to-read,,,,0,0
22822858,A Little Life,Hanya Yanagihara,"Yanagihara, Hanya",,"=""""","=""""",0,4.34,Doubleday,Hardcover,720,2015,2015,,2021/08/28,to-read,to-read (#179),to-read,,,,0,0
28246,"Last of the Wilds (Age of the Five, #2)",Trudi Canavan,"Canavan, Trudi",,"=""0060815914""","=""9780060815912""",4,4.05,"Harper Voyager, HarperCollins Publishers Inc.",Mass Market Paperback,576,2006,2006,2010/01/01,2015/04/21,,,read,,,,2,0
34859192,"Heart of Malice (Alice Worth, #1)",Lisa Edmonds,"Edmonds, Lisa",,"=""1944728341""","=""9781944728342""",0,4.14,City Owl Press,Paperback,338,2017,2017,,2021/08/23,to-read,to-read (#177),to-read,,,,0,0
28248,"Priestess of the White (Age of the Five, #1)",Trudi Canavan,"Canavan, Trudi",,"=""0060815701""","=""9780060815707""",4,3.88,HarperCollins Publishers Inc.,Mass Market Paperback,598,2005,2005,2021/08/21,2015/04/21,,,read,,,,2,0
25003119,Reasons to Stay Alive,Matt Haig,"Haig, Matt",,"=""""","=""""",0,4.08,Canongate Books,Kindle Edition,274,2015,2015,,2021/08/20,to-read,to-read (#176),to-read,,,,0,0
17302559,"Thief's Magic (Millennium’s Rule, #1)",Trudi Canavan,"Canavan, Trudi",,"=""0316209279""","=""9780316209274""",0,3.88,Orbit,Hardcover,553,2014,2014,,2021/08/15,to-read,to-read (#175),to-read,,,,0,0
28251,"The High Lord (Black Magician Trilogy, #3)",Trudi Canavan,"Canavan, Trudi",,"=""1841493155""","=""9781841493152""",5,4.14,Orbit,Paperback,644,2004,2002,,2015/04/21,,,read,,,,2,0
28250,"The Novice (Black Magician Trilogy, #2)",Trudi Canavan,"Canavan, Trudi",,"=""1841493147""","=""9781841493145""",5,4.08,Orbit,Paperback,577,2004,2002,,2015/04/21,,,read,,,,2,0
28249,"The Magicians' Guild (Black Magician Trilogy, #1)",Trudi Canavan,"Canavan, Trudi",,"=""1841493139""","=""9781841493138""",5,3.95,Orbit,Paperback,467,2004,2001,2021/08/06,2015/04/21,,,read,,,,2,0
3342764,"The Magician's Apprentice (Black Magician, #0.5)",Trudi Canavan,"Canavan, Trudi",,"=""0316037885""","=""9780316037884""",5,3.97,Orbit,Hardcover,593,2009,2009,,2019/05/10,,,read,,,,2,0
43306206,"The Courage to Be Disliked: How to Free Yourself, Change your Life and Achieve Real Happiness",Ichiro Kishimi,"Kishimi, Ichiro",Fumitake Koga,"=""""","=""""",0,4.00,Allen & Unwin,Paperback,288,2019,2013,,2021/08/03,to-read,to-read (#174),to-read,,,,0,0
54482639,The Vanishing Half,Brit Bennett,"Bennett, Brit",,"=""""","=""""",0,4.15,Riverhead Books,Hardcover,343,2020,2020,,2021/08/01,to-read,to-read (#173),to-read,,,,0,0
779509,Precious Bane,Mary Webb,"Webb, Mary",,"=""0268015384""","=""9780268015381""",0,4.22,University of Notre Dame Press,Paperback,328,1990,1924,,2021/07/31,wmpa,wmpa (#9),read,,,,0,0
830502,It,Stephen King,"King, Stephen",,"=""0450411435""","=""9780450411434""",2,4.24,New English Library,Paperback,1168,1987,1986,2021/07/28,2020/08/19,,,read,"The child sex-orgy was pretty gross and while I get it fits in with the theme it still didn't fit well with my ethics.<br/><br/>The overarching mythology of the King universe is interesting but the last quarter of the book was so abstract, exploring concepts rather than actual actions and events during fight scenes, I found myself losing interest rapidly. <br/><br/>King's writing is good, as always, but I didn't really like this like I expected to.",true,,1,0
81227,Infidel,Ayaan Hirsi Ali,"Ali, Ayaan Hirsi",,"=""0743289684""","=""9780743289689""",0,4.19,Free Press,Hardcover,353,2007,2006,,2021/07/27,to-read,to-read (#172),to-read,,,,0,0
49645708,Unveiled: How Western Liberals Empower Radical Islam,Yasmine Mohammed,"Mohammed, Yasmine",Rick Fabbro,"=""1999240510""","=""""",0,4.32,Free Hearts Free Minds,Kindle Edition,292,2019,2019,,2021/07/27,to-read,to-read (#171),to-read,,,,0,0
