Book Id,Title,Author,Author l-f,Additional Authors,ISBN,ISBN13,My Rating,Average Rating,Publisher,Binding,Number of Pages,Year Published,Original Publication Year,Date Read,Date Added,Bookshelves,Bookshelves with positions,Exclusive Shelf,My Review,Spoiler,Private Notes,Read Count,Owned Copies
11527504,A Little History of Philosophy (Little Histories),Nigel Warburton,"Warburton, Nigel",,"=""0300152086""","=""9780300152081""",5,4.12,Yale University Press,Hardcover,252,2011,2011,2021/01/11,2021/01/11,,,read,"Brilliant introduction into western philosophy over the ages. This hasn't changed my main philosophical viewpoints but it has changed my personal gauge on what philosophical concepts are important to me: do they make me feel uncomfortable? If so, they are probably important and challenging some concept that I only have a slippery grasp to and can possibly be persuaded away from.<br/><br/>Also thoroughly enjoyable narrator on Audible, I do recommend it.",,,1,0
243685,A History of Western Philosophy,Bertrand Russell,"Russell, Bertrand",,"=""0671201581""","=""9780671201586""",0,4.12,Simon & Schuster,Paperback,906,1986,1945,,2021/01/11,to-read,to-read (#115),to-read,,,,0,0
4671,The Great Gatsby,F. Scott Fitzgerald,"Fitzgerald, F. Scott",,"=""""","=""""",3,3.93,Scribner,Paperback,180,1925,1925,2021/01/09,2020/03/26,,,read,"I found the enigmatic character of Gatsby fascinating, but I felt that while his wealth is eventually explained, his character was still largely mystifying, and that lack of explanation left me feeling unsatisfied. Near the end of the book the main character (who is surprisingly unimportant in the story, so perhaps I should just call him the narrator and observer) begins contemplating on how the tale of Gatsby and the debacle represents America, and how beautiful the rugged land of America is. This felt rather out of place and forced in, or perhaps I missed some connection with the rest of the book.<br/><br/>It's a short read and while worth reading it wouldn't be something I recommend you read with immediacy.",,,1,0
170448,Animal Farm,George Orwell,"Orwell, George","Russell Baker, C.M. Woodhouse","=""0451526341""","=""9780451526342""",5,3.99,Signet Classics,Mass Market Paperback,141,1996,1945,2021/01/08,2021/01/08,,,read,"Throughout my life most people I speak to about animal farm have described it as the ultimate argument against communism. I was always suspicious of this: I read this book as a child and don't recall that being the message but I was a child. So, I've read it again, and the central message, I think, is that power corrupts, and fascism is present in all societal systems without a careful counter measure (such as checks and balances). ",,,1,0
24178,Charlotte’s Web,E.B. White,"White, E.B.","Garth Williams, Rosemary Wells","=""0064410935""","=""9780064410939""",3,4.20,HarperCollinsPublishers,Paperback,184,2001,1952,2007/06/06,2019/10/13,,,read,,,,1,0
2998,The Secret Garden,Frances Hodgson Burnett,"Burnett, Frances Hodgson",,"=""0517189607""","=""9780517189603""",3,4.16,Children's Classics,Hardcover,331,1998,1911,2005/12/31,2019/10/13,,,read,,,,1,0
60748,"A Child Called ""It"" (Dave Pelzer, #1)",Dave Pelzer,"Pelzer, Dave",,"=""""","=""""",4,4.13,Health Communications Inc,Paperback,184,1995,1995,2004/05/07,2019/10/13,,,read,,,,1,0
33124137,Pet Sematary,Stephen King,"King, Stephen",,"=""""","=""""",4,4.06,Scribner,Kindle Edition,580,2014,1983,2007/10/29,2019/10/13,,,read,,,,1,0
1618,The Curious Incident of the Dog in the Night-Time,Mark Haddon,"Haddon, Mark",,"=""1400032717""","=""9781400032716""",4,3.89,Vintage,Paperback,226,2004,2003,2009/08/28,2019/10/13,,,read,,,,1,0
7967,"Speaker for the Dead (Ender's Saga, #2)",Orson Scott Card,"Card, Orson Scott",,"=""0812550757""","=""9780812550757""",4,4.10,Tor Books,Paperback,382,1994,1986,,2020/06/14,,,read,,,,1,0
61535,The Selfish Gene,Richard Dawkins,"Dawkins, Richard",,"=""0199291152""","=""9780199291151""",4,4.15,Oxford University Press,Paperback,360,2006,1976,2014/01/01,2020/06/14,,,read,,,,1,0
386162,"The Hitchhiker’s Guide to the Galaxy (The Hitchhiker's Guide to the Galaxy, #1)",Douglas Adams,"Adams, Douglas",,"=""""","=""""",3,4.23,Del Rey,Paperback,193,2007,1979,,2020/06/14,,,read,,,,1,0
135836,"Trainspotting (Mark Renton, #2)",Irvine Welsh,"Welsh, Irvine",,"=""0099465892""","=""9780099465898""",4,4.10,Vintage,Paperback,431,1994,1993,2021/01/07,2020/06/10,,,read,"Somewhat convoluted tales, the strands didn't quite come together, but that is probably my fault. So very accurate to the culture, psychology and feel of lower class Scotland. Great read.",,,1,0
236093,"The Wonderful Wizard of Oz (Oz, #1)",L. Frank Baum,"Baum, L. Frank",W.W. Denslow,"=""0140621679""","=""9780140621679""",2,4.00,Penguin,Paperback,154,1995,1900,2021/01/04,2021/01/04,,,read,,,,1,0
40242274,A Random Walk Down Wall Street: The Time-Tested Strategy for Successful Investing,Burton G. Malkiel,"Malkiel, Burton G.",,"=""1324002182""","=""9781324002185""",0,4.14,W. W. Norton & Company,Hardcover,432,2019,1973,,2021/01/04,to-read,to-read (#114),to-read,,,,0,0
467032,The Bad Seed,William March,"March, William",Elaine Showalter,"=""0060795484""","=""9780060795481""",2,4.02,Harper Perennial,Paperback,256,2005,1954,2021/01/04,2021/01/03,,,read,"The story itself wasn't bad, but the characters were so incredibly dull. This was an absolute slog to read. I feel like the story could have been told in 10 pages but the author wanted to write more so filled the tome with facile interactions. ",,,1,0
85083,"The Immortal Game: A History of Chess, or How 32 Carved Pieces on a Board Illuminated Our Understanding of War, Art, Science and the Human Brain",David Shenk,"Shenk, David",,"=""0385510101""","=""9780385510103""",0,4.00,Doubleday,Hardcover,352,2006,2006,,2021/01/03,to-read,to-read (#113),to-read,,,,0,0
12067,"Good Omens: The Nice and Accurate Prophecies of Agnes Nutter, Witch",Terry Pratchett,"Pratchett, Terry",Neil Gaiman,"=""""","=""""",3,4.26,William Morrow,Mass Market Paperback,491,2006,1990,2021/01/02,2019/10/03,,,read,,,,1,0
55216191,The Story of China: A portrait of a civilisation and its people,Michael Wood,"Wood, Michael",,"=""1471176002""","=""9781471176005""",5,4.16,Simon & Schuster UK,Kindle Edition,622,2020,2020,2021/01/01,2020/12/20,,,read,"I chose this as something I didn't think I would enjoy but would be important to read. I was half wrong - this was an absolute delight to read. Surprising depth in such breadth based overview of thousands of years of Chinese history. As someone whose only training in history was nationally based and only over 2 years at the ages of 11 & 12, this was highly accessible. The narrator, who is also the author, spoke with objective clarity - while still describing beautiful poetry, song, artwork and cultural masterpieces with passion. Unexpectedly still; Wood presented insight into the mindsets of Chinese women throughout the dynasties with compassion and a feminist heart. I will likely read this again, it is an oddly comforting, enlightening and most enjoyable read.",,,1,0
4214,Life of Pi,Yann Martel,"Martel, Yann",,"=""0770430074""","=""9780770430078""",5,3.94,Seal Books,Paperback,460,2006,2001,2021/01/01,2018/10/13,,,read,"Bit of a mind dump:<br/><br/>A fantastic story with a compelling main character. To have a story with only one perspective and really the only human for large chunks of the tale, shows the incredibly writing ability by Martel. Having seen the film first, I'm happy to say that it is a good representation of the book. While some aspects are missed, the cinematic beauty seen in the film captures the essence of what the character experiences: the majesty of God. Philosophical, introspective and exploring new avenues of thought regarding the role of religion and the worship of deities, this is an excellent book. I cannot truly relate to Pi and his perspective on religion, but reading it through his perspective is fascinating; it does not sway me. I wouldn't consider it a proof of God(s), but the proof of the reality-altering ability the mind appears to have in situations with levels of stress impossible to process.",,,1,0
16299,And Then There Were None,Agatha Christie,"Christie, Agatha",,"=""0312330871""","=""9780312330873""",0,4.28,St. Martin's Griffin,Paperback,264,2004,1939,,2020/12/31,to-read,to-read (#112),to-read,,,,0,0
13538825,"Tombstone: The Great Chinese Famine, 1958-1962",Yang Jisheng,"Jisheng, Yang","Stacy Mosher, Jian Guo","=""0374277931""","=""9780374277932""",0,4.14,"Farrar, Straus and Giroux",Hardcover,656,2012,2008,,2020/12/30,to-read,to-read (#111),to-read,,,,0,0
41913,The Children of Men,P.D. James,"James, P.D.",,"=""0307279901""","=""9780307279903""",0,3.67,Vintage,Paperback,241,2006,1992,,2020/12/28,to-read,to-read (#110),to-read,,,,0,0
23506597,The Governance of China,Xi Jinping,"Jinping, Xi",,"=""7119090577""","=""9787119090573""",0,3.51,Foreign Languages Press,Paperback,515,2014,2014,,2020/12/26,to-read,to-read (#109),to-read,,,,0,0
17824064,"Mythbusting the Cult of Confucius: What the Chinese Really Are, How to Understand Them and Why We Need to",Wayne Deeker,"Deeker, Wayne",,"=""1626520011""","=""9781626520011""",0,4.40,"Mill City Press, Inc.",Paperback,620,2013,2013,,2020/12/26,to-read,to-read (#108),to-read,,,,0,0
2565167,Ta Hio: The Great Learning Of Confucius,Confucius,"Confucius, Confucius",Ezra Pound,"=""1432577840""","=""9781432577841""",0,3.90,Kessinger Publishing,Paperback,48,2007,-480,,2020/12/26,to-read,to-read (#107),to-read,,,,0,0
27318,Confucius Lives Next Door: What Living in the East Teaches Us About Living in the West,T.R. Reid,"Reid, T.R.",,"=""0679777601""","=""9780679777601""",0,3.85,Vintage,Paperback,288,2000,1999,,2020/12/26,to-read,to-read (#106),to-read,,,,0,0
27297,The Analects,Confucius,"Confucius, Confucius",D.C. Lau,"=""0140443487""","=""9780140443486""",0,3.81,Penguin Books Ltd,Paperback,249,1998,-475,,2020/12/26,to-read,to-read (#105),to-read,,,,0,0
5326,A Christmas Carol,Charles Dickens,"Dickens, Charles",,"=""1561797464""","=""9781561797462""",5,4.08,Bethany House Publishers ,Paperback,184,1999,1843,2020/12/24,2020/12/24,,,read,,,,1,0
15790883,"Promise of Blood (Powder Mage, #1)",Brian  McClellan,"McClellan, Brian",,"=""0316219037""","=""9780316219037""",3,4.14,Orbit,Hardcover,545,2013,2013,2020/12/19,2019/10/29,,,read,"An original magic system with fun plot, epic God-levelling events and intriguing male characters. The only female character who could be considered something of a main character (really just a convenient side-kick with deus ex machina type powers) is also a mute, which speaks volumes for how much consideration the author put into adding interesting female leads. However, I heard that the next book improves upon this, so I'll give it a shot. ",,,1,0
12007,"Use of Weapons (Culture, #3)",Iain M. Banks,"Banks, Iain M.",,"=""185723135X""","=""9781857231359""",3,4.17,Orbit,Paperback,411,1992,1990,2019/03/03,2018/12/31,,,read,,,,2,0
7530923,Defining Species: A Sourcebook from Antiquity to Today: 203 (American University Studies),John S. Wilkins,"Wilkins, John S.",,"=""1433102161""","=""9781433102165""",0,0.0,"Peter Lang Inc., International Academic Publishers",Hardcover,238,2009,2009,,2020/12/15,to-read,to-read (#104),to-read,,,,0,0
7042,The Tale of Genji,Murasaki Shikibu,"Shikibu, Murasaki","Royall  Tyler, Minora Sugai, 豐子愷","=""014243714X""","=""9780142437148""",0,3.73,Penguin,Paperback,1182,2003,1001,,2020/12/10,to-read,to-read (#103),to-read,,,,0,0
42603,Black Like Me,John Howard Griffin,"Griffin, John Howard",,"=""0451208641""","=""9780451208644""",0,4.11,NAL Trade,Paperback,208,2003,1961,,2020/12/06,to-read,to-read (#102),to-read,,,,0,0
33939408,Trans Like Me: 'An essential voice at the razor edge of gender politics' Laurie Penny,C.N. Lester,"Lester, C.N.",,"=""0349008612""","=""9780349008615""",5,4.30,Virago,Kindle Edition,224,2017,2017,2020/12/05,2020/12/03,,,read,"I didn't realise I knew nothing until I read this book. Eyes have been opened, at least a little. Trans women are women, trans men are men. ",,,1,0
117833,The Master and Margarita,Mikhail Bulgakov,"Bulgakov, Mikhail","Katherine Tiernan O'Connor, Ellendea Proffer, Diana Lewis Burgin, Hans Fronius","=""0679760806""","=""9780679760801""",0,4.29,Vintage International,Paperback,372,1996,1967,,2020/12/04,to-read,to-read (#101),to-read,,,,0,0
17910144,Talk Like TED: The 9 Public-Speaking Secrets of the World's Top Minds,Carmine Gallo,"Gallo, Carmine",,"=""1250041120""","=""9781250041128""",1,3.88,NXB Phụ Nữ ,Hardcover,363,2017,2014,2020/12/03,2020/12/03,,,read,"Wow. I expected much more from a book with the TED title on front. This entire book is written as a selling point for the book. I've already purchased it. I did not need to be given a sales pitch throughout. There is nothing to be learned here, the best public speakers, I think, learn from analyzing other public speakers. Not from reading a cash-grab which epitomizes the problems in modern self-help books. ",,,1,0
50734400,How to Argue With a Racist: What Our Genes Do (and Don't) Say About Human Difference,Adam Rutherford,"Rutherford, Adam",,"=""1615196714""","=""9781615196715""",5,3.91,The Experiment,Hardcover,224,2020,2020,2020/12/03,2020/12/01,,,read,"A surprisingly accessible read which puts a scientific perspective on the growing problem of pseudoscience backed racist viewpoints. A quick and interesting read, with a handy conclusion chapter that I will likely reread which summarizes all the previously defined points. ",,,1,0
331256,Roadside Picnic,Arkady Strugatsky,"Strugatsky, Arkady","Boris Strugatsky, Theodore Sturgeon, Antonina W. Bouis","=""0575070536""","=""9780575070530""",0,4.15,Gollancz,Paperback,145,2000,1972,,2020/12/03,to-read,to-read (#100),to-read,,,,0,0
3272165,Bad Science,Ben Goldacre,"Goldacre, Ben",,"=""0007240198""","=""9780007240197""",0,4.06,HarperCollins Publishers,Paperback,338,2008,2008,,2020/12/03,to-read,to-read (#99),to-read,,,,0,0
48889983,Calling Bullshit: The Art of Skepticism in a Data-Driven World,Carl T. Bergstrom,"Bergstrom, Carl T.",Jevin D. West,"=""0525509186""","=""9780525509189""",0,4.12,Random House,Hardcover,336,2020,2020,,2020/12/03,to-read,to-read (#98),to-read,,,,0,0
3869,A Brief History of Time,Stephen Hawking,"Hawking, Stephen",,"=""0553380168""","=""9780553380163""",5,4.21,Bantam Books,Paperback,226,1998,1988,2020/12/01,2020/08/19,,,read,"I maybe understood 60% of the content, but I think that's enough to understand the ebb and flow of prominent theories on the beginning, end and current state of the universe. ",,,1,0
3590,"The Adventures of Sherlock Holmes (Sherlock Holmes, #3)",Arthur Conan Doyle,"Doyle, Arthur Conan",,"=""""","=""""",4,4.30,Oxford University Press,Paperback,389,1998,1891,2020/11/25,2020/11/09,,,read,,,,1,0
40961427,1984,George Orwell,"Orwell, George",,"=""""","=""""",5,4.19,Houghton Mifflin Harcourt,Kindle Edition,298,2013,1949,2020/11/23,2020/11/20,,,read,,,,1,0
8650,"The Lost World (Jurassic Park, #2)",Michael Crichton,"Crichton, Michael",,"=""0752224417""","=""9780752224411""",3,3.85,"Alfred A. Knopf, Inc.",Mass Market Paperback,448,1995,1995,2020/11/20,2020/11/13,,,read,"It was fine. Some enjoyable moments with interesting characters, but a far cry from Jurassic Park. ",,,1,0
1030934,The Birds,Daphne du Maurier,"Maurier, Daphne du",,"=""3150092876""","=""9783150092873""",0,3.90,Reclam,Paperback,75,1992,1952,,2020/11/18,to-read,to-read (#97),to-read,,,,0,0
17899948,Rebecca,Daphne du Maurier,"Maurier, Daphne du",,"=""0316323705""","=""9780316323703""",4,4.24,"Little, Brown and Company",ebook,449,2013,1938,2020/11/18,2020/11/14,,,read,"A story that you can revisit in your mind again and again, with in-depth characters that grow and mysteries that unravel. An enjoyable book, even the unnamed, irritatingly shy main character adds a fresh perspective to the cookie-cutter protagonist in a murder mystery.",,,1,0
223919,Frankenstein,Mary Wollstonecraft Shelley,"Shelley, Mary Wollstonecraft",,"=""1587260883""","=""9781587260889""",0,3.87,Ann Arbor Media Group,Hardcover,192,2003,1818,,2020/11/16,to-read,to-read (#96),to-read,,,,0,0
46000520,"The Thursday Murder Club (Thursday Murder Club, #1)",Richard Osman,"Osman, Richard",,"=""""","=""""",0,3.89,Penguin,Kindle Edition,382,2020,2020,,2020/11/15,to-read,to-read (#95),to-read,,,,0,0
40604658,"Jurassic Park (Jurassic Park, #1)",Michael Crichton,"Crichton, Michael",,"=""""","=""""",4,4.10,Ballantine Books,Kindle Edition,466,2012,1990,2020/11/12,2020/11/10,,,read,"Surprised I enjoyed it so much, glad I picked it up on a whim. ",,,1,0
36642458,"Skyward (Skyward, #1)",Brandon Sanderson,"Sanderson, Brandon",,"=""1473217857""","=""9781473217850""",2,4.48,Gollancz,Hardcover,513,2018,2018,2020/11/09,2020/11/07,,,read,,,,1,0
5776788,"Sandman Slim (Sandman Slim, #1)",Richard Kadrey,"Kadrey, Richard",,"=""0061714305""","=""9780061714306""",0,3.94,Harper Voyager,Hardcover,388,2009,2009,,2020/11/08,to-read,to-read (#94),to-read,,,,0,0
9533378,"Hounded (The Iron Druid Chronicles, #1)",Kevin Hearne,"Hearne, Kevin",,"=""0345522478""","=""9780345522474""",0,4.10,Del Rey,Mass Market Paperback,304,2011,2011,,2020/11/08,to-read,to-read (#93),to-read,,,,0,0
216363,The Man in the High Castle,Philip K. Dick,"Dick, Philip K.",,"=""0679740678""","=""9780679740674""",3,3.60,Vintage,Paperback,259,1992,1962,2020/11/07,2020/10/26,,,read,,,,1,0
18616975,"Off to Be the Wizard (Magic 2.0, #1)",Scott  Meyer,"Meyer, Scott",,"=""1612184715""","=""9781612184715""",5,4.00,47North,Paperback,373,2014,2013,2019/09/18,2019/07/04,,,read,Unique concept brilliantly delivered. Fantastic voice acting on the Audible version.,,,2,0
91964,"The Briar King (Kingdoms of Thorn and Bone, #1)",Greg Keyes,"Keyes, Greg",,"=""0330419455""","=""9780330419451""",4,3.75,Tor / Pan Macmillan UK,Paperback,553,2004,2002,2020/11/04,2020/10/30,,,read,,,,1,0
1282013,LITTLE SISTERS,Fay Weldon,"Weldon, Fay",,"=""0340595795""","=""9780340595794""",0,3.52,Sceptre,Paperback,224,1993,1977,,2020/11/03,to-read,to-read (#92),to-read,,,,0,0
10618,Apt Pupil,Stephen King,"King, Stephen",,"=""0751525677""","=""9780751525670""",4,3.92,Warner,Paperback,179,1983,1982,2020/11/03,2020/11/02,,,read,"Thoroughly enjoyable, if unsettling.",,,1,0
10592,Carrie,Stephen King,"King, Stephen",,"=""1416524304""","=""9781416524304""",3,3.99,Pocket,Mass Market Paperback,272,2005,1974,2020/10/26,2020/09/11,,,read,,,,1,0
13895,"The Fires of Heaven (The Wheel of Time, #5)",Robert Jordan,"Jordan, Robert",,"=""1857232097""","=""9781857232097""",5,4.19,Orbit,Paperback,912,1994,1993,2020/10/25,2020/10/07,,,read,What a world.,,,1,0
42267952,"Into the Labyrinth (Mage Errant, #1)",John Bierce,"Bierce, John",,"=""""","=""""",0,4.18,,Kindle Edition,216,2018,2018,,2020/10/23,to-read,to-read (#91),to-read,,,,0,0
761381,The Halloween Tree,Ray Bradbury,"Bradbury, Ray",,"=""0375803017""","=""9780375803017""",3,3.78,Yearling,Paperback,145,2001,1972,2020/10/22,2020/10/22,,,read,"Written like beautiful poetry. A fun tale for children, sadly mostly wasted on me. ",,,1,0
853510,"Murder on the Orient Express (Hercule Poirot, #10)",Agatha Christie,"Christie, Agatha",,"=""0007119313""","=""9780007119318""",5,4.20,HarperCollins,Paperback,274,2007,1934,2020/10/20,2020/10/19,,,read,"My first Christie book. What a tale. So well composed and thought out.<br/><br/>My only issue is with Poirot's perception (similar to the same issue with Moby Dick's ""Ishmael"") that all people from each nationality subgroup have individual character quirks. I don't believe that all Italians have a likeliness to stab nor that all Brits are cold and distant, and it's a rather illogical viewpoint for a detective.<br/><br/>But - I think that is a product of its time. This was originally published in 1934.<br/><br/>I heartily recommend this, in particular the audiobook version which is narrated by the actor for Poirot, David Suchet. He performs a wonderful array of accents and dialects, which really added to my enjoyment.",,,1,0
52350,The Stepford Wives,Ira Levin,"Levin, Ira",Peter Straub,"=""0060080841""","=""9780060080846""",5,3.84,Perennial,Paperback,144,2002,1972,2020/10/13,2020/09/17,,,read,"I wish it was padded out a bit more - the author focused deeply on the story and interactions between characters but Stepford didn't feel as fleshed out as I'd hoped.<br/><br/>Great read, raises interesting questions regarding gender roles and relationships and is eye opening. Must read.",,,1,0
18113998,Marx: Philosophy in an Hour,Paul Strathern,"Strathern, Paul",,"=""""","=""9780007463565""",4,3.27,Harper Press,ebook,,2012,2001,2019/08/26,2019/08/23,,,read,,,,1,0
153747,"Moby-Dick or, The Whale",Herman Melville,"Melville, Herman","Andrew Delbanco, Tom Quirk, William Hootkins, Rockwell Kent, Anton Lomaev","=""0142437247""","=""9780142437247""",3,3.54,Penguin Classics ,Paperback,720,2003,1851,2020/10/06,2020/03/26,,,read,A masterpiece that is exceptionally dull.,,,1,0
68494,"Perdido Street Station (New Crobuzon, #1)",China Miéville,"Miéville, China",,"=""0345459407""","=""9780345459404""",5,3.98,Ballantine Del Rey,Mass Market Paperback,710,2003,2000,2020/10/02,2020/03/26,,,read,I don't know if I'm more impressed by the incredible imaginative designs produced by Melville's mind or the grim expression at the pointlessness of life.<br/><br/>5/5 worth being depressed from.,,,1,0
8664353,"Unbroken: A World War II Story of Survival, Resilience and Redemption",Laura Hillenbrand,"Hillenbrand, Laura",,"=""1400064163""","=""9781400064168""",0,4.38,Random House,Hardcover,475,2010,2010,,2020/09/16,to-read,to-read (#90),to-read,,,,0,0
7736182,"The Lost Hero (The Heroes of Olympus, #1)",Rick Riordan,"Riordan, Rick",,"=""142311339X""","=""9781423113393""",0,4.31,Disney-Hyperion Books,Hardcover,576,2010,2010,,2020/09/16,to-read,to-read (#89),to-read,,,,0,0
128029,A Thousand Splendid Suns,Khaled Hosseini,"Hosseini, Khaled",,"=""1594489505""","=""9781594489501""",0,4.43,Riverhead Books,Hardcover,372,2007,2007,,2020/09/16,to-read,to-read (#88),to-read,,,,0,0
18143977,All the Light We Cannot See,Anthony Doerr,"Doerr, Anthony",,"=""1476746583""","=""9781476746586""",0,4.32,Scribner,Hardcover,531,2014,2014,,2020/09/16,to-read,to-read (#87),to-read,,,,0,0
23302416,"Wonder (Wonder, #1)",R.J. Palacio,"Palacio, R.J.",Raquel Jaramillo,"=""""","=""""",0,4.37,Corgi Childrens,Paperback,318,2013,2012,,2020/09/16,to-read,to-read (#86),to-read,,,,0,0
30852,The Woman Warrior,Maxine Hong Kingston,"Kingston, Maxine Hong",,"=""0679721886""","=""9780679721888""",0,3.73,Vintage,Paperback,204,1989,1976,,2020/09/16,to-read,to-read (#85),to-read,,,,0,0
472331,Watchmen,Alan Moore,"Moore, Alan","Dave Gibbons, John    Higgins","=""0930289234""","=""9780930289232""",0,4.38,DC Comics,Paperback,416,2005,1987,,2020/09/16,to-read,to-read (#84),to-read,,,,0,0
49628,Cloud Atlas,David Mitchell,"Mitchell, David",,"=""0375507256""","=""9780375507250""",0,4.01,Random House,Paperback,509,2004,2004,,2020/09/16,to-read,to-read (#83),to-read,,,,0,0
13145,"Along Came a Spider (Alex Cross, #1)",James Patterson,"Patterson, James",,"=""0446692638""","=""9780446692632""",0,4.13,Grand Central Publishing,Paperback,449,2003,1993,,2020/09/16,to-read,to-read (#82),to-read,,,,0,0
16130,Alexander Hamilton,Ron Chernow,"Chernow, Ron",,"=""""","=""""",0,4.22,Penguin Books,Paperback,818,2005,2004,,2020/09/16,to-read,to-read (#81),to-read,,,,0,0
77566,"Hyperion (Hyperion Cantos, #1)",Dan Simmons,"Simmons, Dan",,"=""0553283685""","=""9780553283686""",0,4.26,Bantam Doubleday Dell Publishing Group,Mass Market Paperback,500,1990,1989,,2020/09/13,to-read,to-read (#80),to-read,,,,0,0
37845813,Things They Left Behind,Stephen King,"King, Stephen",,"=""""","=""""",4,3.88,,Mass Market Paperback,41,2005,,2020/09/13,2020/09/11,,,read,Good short story. Bit sad at the lack of explanation of the potentially supernatural phenomena but mystery isn't always bad either.,,,1,0
43615,"The Gunslinger (The Dark Tower, #1)",Stephen King,"King, Stephen",,"=""""","=""""",4,3.92,Plume,Paperback,231,2003,1982,2017/09/16,2020/09/11,,,read,,,,1,0
60229,Halo: The Fall of Reach,Eric S. Nylund,"Nylund, Eric S.",,"=""0345451325""","=""9780345451323""",0,4.26,Del Rey,Paperback,352,2001,2001,,2020/09/07,to-read,to-read (#78),to-read,,,,0,0
6346098,The House on Maple Street: and Other Stories,Stephen King,"King, Stephen","Tabitha King, Robert B. Parker, Stephen J. Gould","=""0743598210""","=""9780743598217""",3,3.62,Simon & Schuster Audio,Audio CD,5,2009,2009,2020/09/07,2020/08/17,,,read,,,,1,0
50642602,"The Little Book of Humanism: Universal Lessons on Finding Purpose, Meaning and Joy",Andrew Copson,"Copson, Andrew",Alice Roberts,"=""0349425469""","=""9780349425467""",0,4.11,Piatkus,Hardcover,256,2020,2020,,2020/08/28,to-read,to-read (#77),to-read,,,,0,0
33229109,"Riddle-Master: The Complete Trilogy (Riddle-Master, #1-3)",Patricia A. McKillip,"McKillip, Patricia A.",,"=""""","=""9781101662151""",0,4.22,Ace,ebook,,1999,1976,,2020/08/19,to-read,to-read (#76),to-read,,,,0,0
263021,Dreamsnake,Vonda N. McIntyre,"McIntyre, Vonda N.",,"=""0553296590""","=""9780553296594""",0,3.87,Spectra,Mass Market Paperback,312,1994,1978,,2020/08/19,to-read,to-read (#75),to-read,,,,0,0
102267,Our Lady of Darkness,Fritz Leiber,"Leiber, Fritz",,"=""0441644171""","=""9780441644179""",0,3.62,Ace,Mass Market Paperback,183,1984,1977,,2020/08/19,to-read,to-read (#74),to-read,,,,0,0
218427,"Gateway (Heechee Saga, #1)",Frederik Pohl,"Pohl, Frederik",,"=""0345475836""","=""9780345475831""",0,4.06,Del Rey,Paperback,278,2004,1977,,2020/08/19,to-read,to-read (#73),to-read,,,,0,0
9961,Atonement,Ian McEwan,"McEwan, Ian",,"=""""","=""""",4,3.94,Vintage Books,Paperback,375,2002,2001,2008/01/01,2015/04/28,,,read,,,,1,0
30165203,American Gods,Neil Gaiman,"Gaiman, Neil",,"=""""","=""""",4,4.11,William Morrow,Kindle Edition,635,2011,2001,2017/01/01,2019/03/03,,,read,,,,1,0
