Book Id,Title,Author,Author l-f,Additional Authors,ISBN,ISBN13,My Rating,Average Rating,Publisher,Binding,Number of Pages,Year Published,Original Publication Year,Date Read,Date Added,Bookshelves,Bookshelves with positions,Exclusive Shelf,My Review,Spoiler,Private Notes,Read Count,Owned Copies
60111529,"The Primal Hunter (The Primal Hunter, #1)",Zogarth,"Zogarth, Zogarth",,"=""""","=""""",0,4.29,Aethon Books,Kindle Edition,716,2022,2022,,2024/03/28,currently-reading,currently-reading (#6),currently-reading,,,,1,0
21853621,The Nightingale,Kristin Hannah,"Hannah, Kristin",,"=""0312577222""","=""9780312577223""",5,4.62,St. Martin's Press,Hardcover,440,2015,2015,2024/04/01,2020/06/29,,,read,,,,1,0
29093292,"The Daily Stoic: 366 Meditations on Wisdom, Perseverance, and the Art of Living",Ryan Holiday,"Holiday, Ryan",Stephen Hanselman,"=""""","=""""",0,4.37,Portfolio,Hardcover,416,2016,2016,,2024/04/01,to-read,to-read (#483),to-read,,,,0,0
614130,Ten Philosophical Mistakes,Mortimer J. Adler,"Adler, Mortimer J.",,"=""068481868X""","=""9780684818689""",0,3.87,Touchstone,Paperback,200,1996,1985,,2024/03/28,currently-reading,currently-reading (#7),currently-reading,,,,1,0
2767,A People’s History of the United States,Howard Zinn,"Zinn, Howard",,"=""0060838655""","=""9780060838652""",0,4.08,Harper Perennial,Paperback,729,1995,1980,,2024/03/28,to-read,to-read (#482),to-read,,,,0,0
200607509,"Defiance of the Fall 12 (Defiance of the Fall, #12)",TheFirstDefier,"TheFirstDefier, TheFirstDefier",J.F. Brink,"=""""","=""""",3,4.55,Aethon Books,Kindle Edition,702,2024,2024,2024/03/28,2024/01/22,,,read,"I enjoy cultivation but it needs balanced with plot, character development, world building etc. Those all felt lacking, excluding a few great scenes. ",,,1,0
52079565,"Science Fictions: How Fraud, Bias, Incompetence, and Hype Undermine the Search for Truth",Stuart Ritchie,"Ritchie, Stuart",,"=""1250222699""","=""9781250222695""",0,4.38,Metropolitan Books,Hardcover,368,2020,2020,,2024/03/27,to-read,to-read (#481),to-read,,,,0,0
56769575,Stiff: The Curious Lives of Human Cadavers,Mary Roach,"Roach, Mary",,"=""0393881725""","=""9780393881721""",0,4.06,W. W. Norton & Company,Paperback,320,2021,2003,,2024/03/27,to-read,to-read (#480),to-read,,,,0,0
25451852,"Dawn of Wonder (The Wakening, #1)",Jonathan Renshaw,"Renshaw, Jonathan",,"=""""","=""""",0,4.35,Jonathan Renshaw,Kindle Edition,715,2015,2015,,2024/03/26,to-read,to-read (#479),to-read,,,,0,0
22171697,"Fear the Sky (The Fear Saga, #1)",Stephen     Moss,"Moss, Stephen",,"=""""","=""""",0,4.08,Stephen Moss,Kindle Edition,394,2014,2014,,2024/03/25,to-read,to-read (#478),to-read,,,,0,0
195018071,"Defiance of the Fall 11 (Defiance of the Fall, #11)",TheFirstDefier,"TheFirstDefier, TheFirstDefier",J.F. Brink,"=""""","=""""",4,4.59,Aethon Books,Kindle Edition,662,2023,2023,2024/03/24,2024/01/22,,,read,,,,1,0
34298222,"The Gender Games: The Problem with Men and Women, from Someone Who Has Been Both",Juno  Dawson,"Dawson, Juno",,"=""1473648580""","=""9781473648586""",4,4.10,Two Roads,Hardcover,368,2017,2017,2024/03/19,2024/03/13,,,read,The writing wasn't the best but the content was enlightening.,,,1,0
4989,The Red Tent,Anita Diamant,"Diamant, Anita",,"=""0312353766""","=""9780312353766""",0,4.20,St. Martin's Press,Hardcover,324,1997,1997,,2024/03/18,to-read,to-read (#477),to-read,,,,0,0
134582757,"Defiance of the Fall 10 (Defiance of the Fall, #10)",TheFirstDefier,"TheFirstDefier, TheFirstDefier",J.F. Brink,"=""""","=""""",4,4.55,Aethon Books,Kindle Edition,564,2023,2023,2024/03/18,2024/01/22,,,read,,,,1,0
65213543,"Bookshops & Bonedust (Legends & Lattes, #0)",Travis  Baldree,"Baldree, Travis",,"=""1250886104""","=""9781250886101""",0,4.24,Tor Trade,Paperback,352,2023,2023,,2024/03/17,to-read,to-read (#476),to-read,,,,0,0
7785194,The Moral Landscape: How Science Can Determine Human Values,Sam Harris,"Harris, Sam",,"=""1439171211""","=""9781439171219""",0,3.90,Free Press,Hardcover,291,2010,2010,,2024/03/14,currently-reading,currently-reading (#5),currently-reading,,,,1,0
17125,One Day in the Life of Ivan Denisovich,Aleksandr Solzhenitsyn,"Solzhenitsyn, Aleksandr","Ronald Hingley, H.T. Willetts, Leopold Labedz, Max Hayward","=""""","=""""",0,3.98,"Farrar, Straus and Giroux",Paperback,182,2005,1962,,2021/08/28,to-read,to-read (#178),to-read,,,,0,0
1781546,One step at a time: Buddhist meditation for absolute beginners,phra-peter-pannapadipo,"phra-peter-pannapadipo, phra-peter-pannapadipo",,"=""9742020302""","=""9789742020309""",3,2.92,Bangkok Writers,Paperback,,1999,,2024/03/14,2024/03/13,,,read,"Some useful tips and insights, but perhaps too basic. Much of the non-Buddhist tips are somewhat obvious for anyone with personal experience with mindfulness, meditation, prayer or intentional thinking.<br/><br/>The notes I took were about two pages, which is about all of the useful parts of this book. This may be different for you, more or less utility, based on your own experience with mindfulness and meditation.",,,1,0
64369,Mindfulness in Plain English,Henepola Gunaratana,"Gunaratana, Henepola",Lauri Porceddu,"=""0861713214""","=""9780861713219""",0,4.15,Wisdom Publications,Paperback,208,1996,1992,,2024/03/13,to-read,to-read (#475),to-read,,,,0,0
142235363,"Defiance of the Fall 9 (Defiance of the Fall, #9)",TheFirstDefier,"TheFirstDefier, TheFirstDefier",J.F. Brink,"=""""","=""""",4,4.50,Aethon Books,Kindle Edition,771,2023,2023,2024/03/13,2024/01/22,,,read,,,,1,0
204736844,"Poverty, by America",Matthew Desmond,"Desmond, Matthew",,"=""0593239938""","=""9780593239933""",0,4.28,Crown,Paperback,320,2024,2023,,2024/03/11,to-read,to-read (#474),to-read,,,,0,0
12870068,The Etymologicon: A Circular Stroll through the Hidden Connections of the English Language,Mark Forsyth,"Forsyth, Mark",,"=""""","=""""",5,4.23,Icon Books,Hardcover,252,2011,2011,2024/03/10,2024/03/10,,,read,"Quite fun and not at all what I expected. Mark Forsyth's wit comes across so well, which is surprising since I expected this to be an academically interesting but generally dull subject. A great read. ",,,1,0
29353087,The Science of Mindfulness: A Research-Based Path to Well-Being,Ronald D. Siegel,"Siegel, Ronald D.",,"=""1598035649""","=""9781598035643""",0,4.24,The Teaching Company,Audio CD,6,2014,2014,,2024/03/10,currently-reading,currently-reading (#4),currently-reading,,,,1,0
35414514,We Were the Lucky Ones,Georgia Hunter,"Hunter, Georgia",,"=""0399563091""","=""9780399563096""",0,4.41,Penguin Books,Paperback,416,2018,2017,,2024/03/10,to-read,to-read (#473),to-read,,,,0,0
193544861,When She Was Me,Marlee Bush,"Bush, Marlee",,"=""172828953X""","=""9781728289533""",0,3.86,Poisoned Pen Press,Paperback,400,2024,2024,,2024/03/09,to-read,to-read (#472),to-read,,,,0,0
208156233,Walk of Shame,Avery Flynn,"Flynn, Avery",,"=""""","=""9798879142372""",0,3.95,Independently published,Paperback,330,2024,,,2024/03/09,to-read,to-read (#471),to-read,,,,0,0
199532188,"The Amethyst Kingdom (The Five Crowns of Okrith, #5)",A.K. Mulford,"Mulford, A.K.",,"=""0063291789""","=""9780063291782""",0,4.68,Harper Voyager,Paperback,352,2024,2024,,2024/03/09,to-read,to-read (#470),to-read,,,,0,0
195791689,Hum,Helen          Phillips,"Phillips, Helen",,"=""1668008831""","=""9781668008836""",0,4.20,S&S/ Marysue Rucci Books,Hardcover,272,2024,2024,,2024/03/09,to-read,to-read (#469),to-read,,,,0,0
197036035,That Night in the Library,Eva Jurczyk,"Jurczyk, Eva",,"=""1728295696""","=""9781728295695""",0,3.09,Poisoned Pen Press,Paperback,288,2024,2024,,2024/03/09,to-read,to-read (#468),to-read,,,,0,0
199534723,"The Gilded Crown (The Raven's Trade, #1)",Marianne  Gordon,"Gordon, Marianne",,"=""0063248778""","=""9780063248779""",0,3.70,Harper Voyager,Paperback,384,2024,2023,,2024/03/09,to-read,to-read (#467),to-read,,,,0,0
199793668,The Dollmakers,Lynn Buchanan,"Buchanan, Lynn",,"=""0063308266""","=""9780063308268""",0,4.38,Harper Voyager,Paperback,400,2024,2024,,2024/03/09,to-read,to-read (#466),to-read,,,,0,0
60751621,The House of Spark,Luminita LaFlash,"LaFlash, Luminita",,"=""0578254611""","=""9780578254616""",0,4.47,Luminita LaFlash,Paperback,166,2022,,,2024/03/09,to-read,to-read (#465),to-read,,,,0,0
205205475,How to Work with Anyone,Raluca Graebner,"Graebner, Raluca",,"=""""","=""""",2,3.38,,Audible Audio,,,,2024/03/09,2024/03/09,,,read,"I suppose the lessons are insightful if you take them away and ponder on them for your personal situation, but there's nothing provided that isn't immediately obvious from living in a society with other people that you sometimes converse with. ",,,1,0
92057,The Autobiography of Malcolm X,Malcolm X,"X, Malcolm",Alex Haley,"=""""","=""""",4,4.36,Ballantine Books,Mass Market Paperback,466,2015,1965,2024/03/09,2024/01/17,,,read,"Insightful to hear the true thoughts of one so crucial to the civil rights movement in the USA, one unfiltered and spoken with understandable hatred and passion.",,,1,0
63059438,"Defiance of the Fall 8 (Defiance of the Fall, #8)",TheFirstDefier,"TheFirstDefier, TheFirstDefier",J.F. Brink,"=""""","=""""",3,4.52,Aethon Books,Kindle Edition,748,2023,2023,2024/03/07,2024/01/22,,,read,,,,1,0
61853193,"Defiance of the Fall 7 (Defiance of the Fall, #7)",TheFirstDefier,"TheFirstDefier, TheFirstDefier",J.F. Brink,"=""""","=""""",3,4.45,Aethon Books,Kindle Edition,798,2022,2022,2024/03/01,2024/01/22,,,read,,,,1,0
61771675,Hello Beautiful,Ann Napolitano,"Napolitano, Ann",,"=""""","=""""",3,4.18,The Dial Press,Kindle Edition,416,2023,2023,2024/02/27,2024/01/26,,,read,,,,1,0
53300479,How to Defeat a Demon King in Ten Easy Steps,Andrew Rowe,"Rowe, Andrew","Suzy Jackson, Steve West","=""""","=""""",0,4.02,Audible Original,Audible Audio,6,2020,2020,,2024/02/26,to-read,to-read (#464),to-read,,,,0,0
55740170,God's Eye: Awakening: A Labyrinth World Novel,Aleron Kong,"Kong, Aleron",,"=""""","=""9798697387054""",0,4.40,"Tamori Publications, LLC",Paperback,650,2020,2020,,2024/02/26,to-read,to-read (#463),to-read,,,,0,0
158194054,Death Loot & Vampires (The Vampire Vincent #1),Benjamin Kerei,"Kerei, Benjamin",,"=""0473680327""","=""9780473680329""",0,4.58,Benjamin Kerei,Kindle Edition,392,2023,2023,,2024/02/26,to-read,to-read (#462),to-read,,,,0,0
1627,Brokeback Mountain,Annie Proulx,"Proulx, Annie",,"=""0743271327""","=""9780743271325""",5,3.99,Scribner,Paperback,55,2005,1997,2024/02/22,2024/02/22,,,read,,,,1,0
61197352,"Defiance of the Fall 6 (Defiance of the Fall, #6)",TheFirstDefier,"TheFirstDefier, TheFirstDefier",J.F. Brink,"=""""","=""""",4,4.41,Aethon Books,Kindle Edition,782,2022,2022,2024/02/22,2024/01/22,,,read,,,,1,0
16144853,Leaders Eat Last: Why Some Teams Pull Together and Others Don't,Simon Sinek,"Sinek, Simon",,"=""1591845327""","=""9781591845324""",0,4.10,Portfolio,Hardcover,350,2014,2014,,2024/02/22,to-read,to-read (#461),to-read,,,,0,0
61242426,"Legends & Lattes (Legends & Lattes, #1)",Travis  Baldree,"Baldree, Travis",,"=""""","=""""",0,4.15,Tor,Kindle Edition,296,2022,2022,,2024/02/21,to-read,to-read (#460),to-read,,,,0,0
52284628,"Shade's First Rule (Divine Apostasy, #1)",A.F. Kay,"Kay, A.F.",,"=""""","=""""",0,4.28,Black Pyramid Press,Kindle Edition,434,2019,2019,,2024/02/21,to-read,to-read (#459),to-read,,,,0,0
60526795,Domestication (Battle Mage Farmer #1),Seth Ring,"Ring, Seth",,"=""""","=""""",0,4.47,Aethon Books,Kindle Edition,412,2022,2022,,2024/02/21,to-read,to-read (#458),to-read,,,,0,0
44244559,"Survival (Shadow Sun, #1)",Dave Willmarth,"Willmarth, Dave",,"=""""","=""""",0,4.33,,Kindle Edition,511,2019,2019,,2024/02/21,to-read,to-read (#457),to-read,,,,0,0
57437732,Ravenous (Necrotic Apocalypse #1),David  Petrie,"Petrie, David",,"=""1637660251""","=""9781637660256""",0,4.31,Mountaindale Press,Kindle Edition,529,2021,,,2024/02/21,to-read,to-read (#456),to-read,,,,0,0
59089569,"The Legend of Randidly Ghosthound (The Legend of Randidly Ghosthound, #1)",Noret Flood,"Flood, Noret",puddles4263,"=""""","=""""",0,4.39,Aethon Books,Kindle Edition,574,2021,,,2024/02/21,to-read,to-read (#455),to-read,,,,0,0
43895146,"The Dungeon Traveler (Dungeon Travels, #1)",Alston Sleet,"Sleet, Alston",,"=""0998828327""","=""9780998828329""",0,4.16,,Kindle Edition,336,2019,,,2024/02/21,to-read,to-read (#454),to-read,,,,0,0
63645843,"All the Skills (All the Skills, #1)",Honour Rae,"Rae, Honour",,"=""""","=""""",0,4.58,Avocado Ink Publishing,Kindle Edition,513,2022,2022,,2024/02/21,to-read,to-read (#453),to-read,,,,0,0
195047626,"Wish Upon the Stars 1 (Wish Upon the Stars, #1)",Malcolm Tent,"Tent, Malcolm",,"=""1956021264""","=""9781956021264""",0,4.41,Timeless Wind Publishing LLC,Kindle Edition,373,2023,,,2024/02/21,to-read,to-read (#452),to-read,,,,0,0
17879100,"Super Powereds: Year 1 (Super Powereds, #1)",Drew  Hayes,"Hayes, Drew",,"=""""","=""""",0,4.36,,Kindle Edition,814,,2013,,2024/02/21,to-read,to-read (#451),to-read,,,,0,0
200583376,Fleabag: A Monster Evolution LitRPG,SomeoneToForget,"SomeoneToForget, SomeoneToForget",,"=""1039443567""","=""9781039443563""",0,4.34,Podium Publishing,Kindle Edition,0,2023,,,2024/02/19,to-read,to-read (#450),to-read,,,,0,0
35031085,Frankenstein: The 1818 Text,Mary Wollstonecraft Shelley,"Shelley, Mary Wollstonecraft",Charlotte Gordon,"=""""","=""""",3,3.87,Penguin Classics,Paperback,260,2018,1818,2024/02/17,2024/02/16,,,read,,,,1,0
60498348,"Defiance of the Fall 5 (Defiance of the Fall, #5)",TheFirstDefier,"TheFirstDefier, TheFirstDefier",J.F. Brink,"=""""","=""""",4,4.53,Aethon Books,Kindle Edition,662,2022,2022,2024/02/16,2024/01/22,,,read,,,,1,0
59763121,"Defiance of the Fall 4 (Defiance of the Fall, #4)",TheFirstDefier,"TheFirstDefier, TheFirstDefier",J.F. Brink,"=""""","=""""",3,4.52,Aethon Books,Kindle Edition,811,2022,2022,2024/02/10,2024/01/22,,,read,Five stars if not for that uncomfortable scene with the underwear.,,,1,0
123165953,"The Captain (The Last Horizon, #1)",Will Wight,"Wight, Will",,"=""""","=""""",0,4.30,Hidden Gnome Publishing,Kindle Edition,467,2023,2023,,2024/02/09,to-read,to-read (#449),to-read,,,,0,0
32335775,Finding Meaning in an Imperfect World,Iddo Landau,"Landau, Iddo",,"=""0190657669""","=""9780190657666""",0,3.92,Oxford University Press,Hardcover,312,2017,,,2024/02/09,to-read,to-read (#448),to-read,,,,0,0
236765,I Don't Want to Talk About It: Overcoming the Secret Legacy of Male Depression,Terrence Real,"Real, Terrence",,"=""0684835398""","=""9780684835396""",0,4.31,Scribner,Paperback,384,1998,1997,,2024/02/09,to-read,to-read (#447),to-read,,,,0,0
33776099,"The Resilience Workbook: Essential Skills to Recover from Stress, Trauma, and Adversity (A New Harbinger Self-Help Workbook)",Glenn R. Schiraldi,"Schiraldi, Glenn R.",,"=""1626259402""","=""9781626259409""",0,4.10,New Harbinger Publications,Paperback,288,2017,,,2024/02/09,to-read,to-read (#446),to-read,,,,0,0
2222,The Feeling Good Handbook,David D. Burns,"Burns, David D.",,"=""0452281326""","=""9780452281325""",0,3.94,Plume,Paperback,729,1999,1989,,2024/02/09,to-read,to-read (#445),to-read,,,,0,0
25899336,When Breath Becomes Air,Paul Kalanithi,"Kalanithi, Paul",Abraham   Verghese,"=""""","=""""",3,4.40,Random House,Kindle Edition,208,2016,2016,2024/02/08,2023/06/29,,,read,,,,1,0
58537365,Unmasking Autism: Discovering the New Faces of Neurodiversity,Devon  Price,"Price, Devon",,"=""0593235231""","=""9780593235232""",4,4.47,Harmony,Hardcover,304,2022,2022,2024/02/07,2023/08/23,,,read,,,,1,0
59364173,I'm Glad My Mom Died,Jennette McCurdy,"McCurdy, Jennette",,"=""""","=""""",5,4.47,Simon & Schuster,ebook,320,2022,2022,2024/02/03,2024/01/19,,,read,,,,1,0
30286680,A Boy and His Dog,Harlan Ellison,"Ellison, Harlan",,"=""1504038258""","=""9781504038256""",0,3.85,Open Road Media Sci-Fi  Fantasy,ebook,77,2016,1969,,2024/02/02,to-read,to-read (#444),to-read,,,,0,0
60123297,How to be an Anti-Capitalist in the 21st Century,Erik Olin Wright,"Wright, Erik Olin",,"=""""","=""""",3,3.93,,Paperback,176,2021,2019,2024/02/01,2023/08/21,,,read,,,,1,0
169437,Botchan,Natsume Sōseki,"Sōseki, Natsume",Joel Cohn,"=""4770030487""","=""9784770030481""",0,3.64,Kodansha USA,Paperback,171,2007,1906,,2024/01/31,to-read,to-read (#443),to-read,,,,0,0
2984286,A Rose for Emily,William Faulkner,"Faulkner, William",,"=""1563127881""","=""9781563127885""",2,3.83,Perfection Learning,Paperback,36,1990,1930,2024/01/29,2023/02/22,,,read,,,,1,0
286957,The Yellow Wall-Paper,Charlotte Perkins Gilman,"Gilman, Charlotte Perkins",Elaine Hedges,"=""1558611584""","=""9781558611580""",5,4.10,The Feminist Press at CUNY,Paperback,64,1996,1892,2024/01/29,2024/01/29,,,read,,,,1,0
33395557,"For We Are Many (Bobiverse, #2)",Dennis E. Taylor,"Taylor, Dennis E.",Ray Porter,"=""""","=""""",4,4.37,Audible Studios,Audible Audio,9,2017,2017,2023/07/06,2023/07/03,wmpa,wmpa (#38),read,"Also fails the Bechdel test, which is a grand shame because it's a fun read like the first.",,,2,0
3591262,Cutting for Stone,Abraham   Verghese,"Verghese, Abraham",,"=""0375414495""","=""9780375414497""",0,4.32,Alfred A. Knopf,Hardcover,560,2009,2009,,2024/01/29,to-read,to-read (#442),to-read,,,,0,0
58769603,"Defiance of the Fall 3 (Defiance of the Fall, #3)",TheFirstDefier,"TheFirstDefier, TheFirstDefier",J.F. Brink,"=""""","=""""",4,4.54,Aethon Books,Kindle Edition,868,2021,2021,2024/01/26,2024/01/22,,,read,,,,1,0
136342745,"The Aeronaut's Windlass (The Cinder Spires, #1)",Jim Butcher,"Butcher, Jim",,"=""0593642058""","=""9780593642054""",0,4.18,Ace,Paperback,656,2023,2015,,2023/06/16,abandoned,abandoned (#36),abandoned,,,,0,0
25614898,When Breath Becomes Air,Paul Kalanithi,"Kalanithi, Paul",Abraham   Verghese,"=""081298840X""","=""9780812988406""",0,4.40,Random House,Hardcover,229,2016,2016,,2024/01/25,to-read,to-read (#441),to-read,,,,0,0
69621499,Pit Fighter (Victor of Tucson #1),Plum Parrot,"Parrot, Plum",,"=""1039418864""","=""9781039418868""",0,4.42,Podium Publishing,Kindle Edition,333,2023,2023,,2024/01/23,to-read,to-read (#440),to-read,,,,0,0
58341974,"Defiance of the Fall 2 (Defiance of the Fall, #2)",TheFirstDefier,"TheFirstDefier, TheFirstDefier",J.F. Brink,"=""""","=""""",5,4.57,Aethon Books,Kindle Edition,638,2021,2021,2024/01/17,2024/01/04,,,read,,,,1,0
50867689,The Land: Swarm: A Litrpg Saga (Chaos Seeds),Aleron Kong,"Kong, Aleron",,"=""1643160478""","=""9781643160474""",0,4.34,Tamori Publications LLC,Hardcover,480,2018,2016,,2024/01/17,to-read,to-read (#439),to-read,,,,0,0
62047984,Yellowface,R.F. Kuang,"Kuang, R.F.",,"=""""","=""""",4,3.80,William Morrow,Hardcover,336,2023,2023,2024/01/15,2024/01/01,,,read,,,,1,0
7723892,"Masters Of Greek Thought: Plato, Socrates, And Aristotle",Robert C. Bartlett,"Bartlett, Robert C.",,"=""159803443X""","=""9781598034431""",3,4.05,The Great Courses,Audible Audio,19,2008,2008,2024/01/13,2024/01/04,,,read,,,,1,0
1091478,Noon: 22nd Century,Arkady Strugatsky,"Strugatsky, Arkady","Boris Strugatsky, Patrick L. McGuire, Theodore Sturgeon, Richard M. Powers","=""0026151502""","=""9780026151504""",0,4.00,Macmillan Publishing Co.,Hardcover,319,1978,1961,,2024/01/12,to-read,to-read (#438),to-read,,,,0,0
40030019,No. More. Plastic.: What you can do to make a difference – the #2minutesolution,Martin Dorey,"Dorey, Martin",Chris Packham,"=""""","=""""",0,4.02,Ebury Digital,Kindle Edition,103,2018,2018,,2024/01/05,to-read,to-read (#437),to-read,,,,0,0
6936019,"The Story of Stuff: How Our Obsession with Stuff is Trashing the Planet, Our Communities, and our Health—and a Vision for Change",Annie Leonard,"Leonard, Annie",,"=""143912566X""","=""9781439125663""",0,4.08,Free Press,Hardcover,352,2010,2010,,2024/01/05,to-read,to-read (#436),to-read,,,,0,0
57434151,"Harlots, Whores & Hackabouts: A History of Sex for Sale",Kate  Lister,"Lister, Kate",,"=""0500252440""","=""9780500252444""",0,4.23,Thames & Hudson,Hardcover,256,2021,,,2024/01/02,to-read,to-read (#435),to-read,,,,0,0
54776211,A Fatal Thing Happened on the Way to the Forum: Murder in Ancient Rome,Emma Southon,"Southon, Emma",,"=""1419753053""","=""9781419753053""",0,4.10,Harry N. Abrams,Hardcover,352,2021,2020,,2024/01/02,to-read,to-read (#434),to-read,,,,0,0
57866482,"Defiance of the Fall (Defiance of the Fall, #1)",TheFirstDefier,"TheFirstDefier, TheFirstDefier",J.F. Brink,"=""""","=""""",3,4.38,Aethon Books,Kindle Edition,765,2021,2021,2024/01/02,2023/09/13,,,read,,,,1,0
62586003,Ultra-Processed People: The Science Behind Food That Isn't Food,Chris van Tulleken,"Tulleken, Chris van",,"=""1324036729""","=""9781324036722""",0,4.44,W. W. Norton & Company,Hardcover,384,2023,2023,,2024/01/02,to-read,to-read (#433),to-read,,,,0,0
11099729,Darth Plagueis (Star Wars),James Luceno,"Luceno, James",,"=""034551128X""","=""9780345511287""",0,4.16,"LucasBooks/Del Rey Books/Ballantine Books/Random House, Inc.",Hardcover,379,2012,2012,,2024/01/02,to-read,to-read (#432),to-read,,,,0,0
4443,The Different Drum: Community Making and Peace,M. Scott Peck,"Peck, M. Scott",,"=""0684848589""","=""9780684848587""",0,3.93,Touchstone,Paperback,334,1998,1987,,2024/01/01,to-read,to-read (#431),to-read,,,,0,0
37424706,The Art of Gathering: How We Meet and Why It Matters,Priya Parker,"Parker, Priya",,"=""1594634920""","=""9781594634925""",0,3.98,Riverhead Books,Hardcover,304,2018,2018,,2024/01/01,to-read,to-read (#430),to-read,,,,0,0
232438,Creating a Life Together: Practical Tools to Grow Ecovillages and Intentional Communities,Diana Leafe Christian,"Christian, Diana Leafe",Patch Adams,"=""0865714711""","=""9780865714717""",0,4.18,New Society Publishers,Paperback,272,2003,2003,,2024/01/01,to-read,to-read (#429),to-read,,,,0,0
676416,Farming for Self-Sufficiency: Independence on a 5-Acre Farm,John Seymour,"Seymour, John",,"=""0805235256""","=""9780805235258""",0,4.07,Pendulum Press,Paperback,256,1987,1987,,2024/01/01,to-read,to-read (#428),to-read,,,,0,0
2369328,Country Women: A Handbook for the New Farmer,Jeanne Tetrault,"Tetrault, Jeanne",Sherry  Thomas,"=""0385030622""","=""9780385030625""",0,4.41,Doubleday,Paperback,381,1976,1976,,2024/01/01,to-read,to-read (#427),to-read,,,,0,0
61358638,"Poverty, by America",Matthew Desmond,"Desmond, Matthew",,"=""0593239911""","=""9780593239919""",0,4.28,Crown,Hardcover,284,2023,2023,,2024/01/01,to-read,to-read (#426),to-read,,,,0,0
55559974,"Iron Prince (Warformed: Stormweaver, #1)",Bryce O'Connor,"O'Connor, Bryce",Luke Chmilenko,"=""099919206X""","=""""",0,4.59,"Wraithmarked Creative, LLC",Kindle Edition,850,2020,2020,,2022/08/27,abandoned,abandoned (#35),abandoned,,,,0,0
60784614,Cobalt Red: How the Blood of the Congo Powers Our Lives,Siddharth Kara,"Kara, Siddharth",,"=""1250284309""","=""9781250284303""",5,4.38,St. Martin's Press,Hardcover,288,2023,2023,2023/12/21,2023/12/12,,,read,"A must read for anyone in tech, anyone in the sciences, anyone with a heart. ",,,1,0
131499749,"He Who Fights with Monsters 10 (He Who Fights with Monsters, #10)",Shirtaloon,"Shirtaloon, Shirtaloon",,"=""""","=""""",5,4.55,Aethon Books,Kindle Edition,758,2023,2023,2023/12/15,2023/11/15,,,read,,,,1,0
40514420,How Music and Mathematics Relate,David Kung,"Kung, David",,"=""1598039741""","=""9781598039740""",0,3.93,Great Courses,Audio CD,120,2013,2013,,2023/06/20,abandoned,abandoned (#34),abandoned,,,,0,0
123852910,"Azarinth Healer: Book Two (Azarinth Healer, #2)",Rhaegar,"Rhaegar, Rhaegar",,"=""""","=""""",0,4.49,Portal Books,Kindle Edition,719,2023,2023,,2023/12/11,to-read,to-read (#425),to-read,,,,0,0
63260494,"Azarinth Healer: Book One (Azarinth Healer, #1)",Rhaegar,"Rhaegar, Rhaegar",,"=""""","=""""",0,4.53,Portal Books,Kindle Edition,708,2022,2022,,2023/12/11,to-read,to-read (#424),to-read,,,,0,0
68046804,He Who Fights with Monsters 9 (He Who Fights with Monsters #9),Shirtaloon,"Shirtaloon, Shirtaloon",Travis Deverell,"=""""","=""""",5,4.57,Aethon Books,Kindle Edition,662,2023,2023,2023/12/09,2023/11/15,,,read,,,,1,0
62331485,"He Who Fights With Monsters 8 (He Who Fights with Monsters, #8)",Shirtaloon,"Shirtaloon, Shirtaloon",Travis Deverell,"=""""","=""""",3,4.51,Aethon Books,Kindle Edition,624,2022,2022,2023/11/30,2023/11/15,,,read,,,,1,0
40529986,"Food, Science and the Human Body",Alyssa Crittenden,"Crittenden, Alyssa",,"=""""","=""""",4,3.78,,Audible Audio,18,,,2023/11/25,2023/10/23,,,read,,,,1,0
61379442,"He Who Fights With Monsters 7 (He Who Fights with Monsters, #7)",Shirtaloon,"Shirtaloon, Shirtaloon",Travis Deverell,"=""""","=""""",3,4.59,Aethon Books,Kindle Edition,622,2022,2022,2023/11/21,2023/11/15,,,read,,,,1,0
60725860,"He Who Fights with Monsters 6 (He Who Fights with Monsters, #6)",Shirtaloon,"Shirtaloon, Shirtaloon",Travis Deverell,"=""""","=""""",4,4.52,Aethon Books,Kindle Edition,564,2022,2022,2023/11/18,2023/11/15,,,read,,,,1,0
59906678,"He Who Fights with Monsters 5 (He Who Fights with Monsters, #5)",Shirtaloon,"Shirtaloon, Shirtaloon",Travis Deverell,"=""""","=""""",4,4.50,Aethon Books,Kindle Edition,759,2022,2022,2023/11/15,2023/11/11,,,read,,,,1,0
58821848,"He Who Fights with Monsters 4 (He Who Fights with Monsters, #4)",Shirtaloon,"Shirtaloon, Shirtaloon",,"=""""","=""""",5,4.54,Aethon Books,Kindle Edition,828,2021,2021,2023/11/11,2023/11/06,,,read,,,,1,0
58088499,"He Who Fights with Monsters 3 (He Who Fights with Monsters, #3)",Shirtaloon,"Shirtaloon, Shirtaloon",,"=""""","=""""",4,4.51,Aethon Books,Kindle Edition,895,2021,2021,2023/11/06,2023/11/01,,,read,,,,1,0
25387895,The Confidence Game: Why We Fall for It . . . Every Time,Maria Konnikova,"Konnikova, Maria",,"=""0525427414""","=""9780525427414""",0,3.65,Viking,Hardcover,352,2016,2015,,2023/11/02,to-read,to-read (#395),to-read,,,,0,0
57456018,"He Who Fights with Monsters 2 (He Who Fights with Monsters, #2)",Shirtaloon,"Shirtaloon, Shirtaloon",,"=""""","=""""",5,4.57,Aethon Books,Kindle Edition,826,2021,2021,2023/10/31,2023/10/24,,,read,Fun read.,,,1,0
